{
  "$schema": "https://anthropic.com/claude-code/marketplace.schema.json",
  "name": "hugin-marketplace",
  "description": "Marketplace catalog for hugin-v0 — design-to-production React 19 apps with Claude Code.",
  "owner": {
    "name": "Michel Velis",
    "email": "mvelis90@gmail.com"
  },
  "plugins": [
    {
      "name": "hugin-v0",
      "description": "Ship design-to-production React 19 apps with Claude Code — Figma-to-code translation, automated code reviews, architecture guardrails, and accessibility enforcement for designers and engineers.",
      "source": {
        "source": "url",
        "url": "https://github.com/michelve/hugin-v0.git"
      },
      "category": "development",
      "homepage": "https://github.com/michelve/hugin-v0"
    }
  ]
}
